number,value,datetime_start,datetime_complete,duration,params_alpha,params_batch_size,params_bottleneck_dim,params_channel_config,params_learning_rate,user_attrs_trained,system_attrs_tpe:relative_params:0,state
0,0.3296424001455307,2026-10-03 05:30:13.611310,2026-10-03 05:32:09.870019,0 days 00:01:56.258709,0.5,16,64,shallow,0.0005611516415334506,True,,COMPLETE
1,0.4176230728626251,2026-10-03 05:32:09.880724,2026-10-03 05:35:20.893937,0 days 00:03:11.013213,0.55,64,64,deep,0.008706020878304856,True,,COMPLETE
2,,2026-10-03 05:35:20.902385,2026-10-03 05:35:20.925080,0 days 00:00:00.022695,0.5,32,256,deep,0.0003839629299804173,False,,PRUNED
3,0.6037122011184692,2026-10-03 05:35:20.932716,2026-10-03 05:37:19.582672,0 days 00:01:58.649956,1.0,32,64,standard,0.007902619549708232,True,,COMPLETE
4,0.3587282635271549,2026-10-03 05:37:19.591323,2026-10-03 05:40:12.725327,0 days 00:02:53.134004,0.8,32,64,deep,0.00032927591344236165,True,,COMPLETE
5,0.5141811370849609,2026-10-03 05:40:12.734420,2026-10-03 05:42:18.015355,0 days 00:02:05.280935,0.75,16,128,standard,0.0069782812651260325,True,,COMPLETE
6,,2026-10-03 05:42:18.024706,2026-10-03 05:42:18.045642,0 days 00:00:00.020936,0.9,16,256,shallow,0.00019135880487692312,False,,PRUNED
7,,2026-10-03 05:42:18.053440,2026-10-03 05:42:18.074047,0 days 00:00:00.020607,0.8500000000000001,64,256,shallow,0.00014063366777718192,False,,PRUNED
8,,2026-10-03 05:42:18.081877,2026-10-03 05:42:18.103160,0 days 00:00:00.021283,0.5,32,256,deep,0.0059487468132197715,False,,PRUNED
9,0.6196307688951492,2026-10-03 05:42:18.111425,2026-10-03 05:43:27.331985,0 days 00:01:09.220560,0.5,32,128,standard,0.00016435497475111326,True,,PRUNED
10,0.3423556201159954,2026-10-03 05:43:27.341801,2026-10-03 05:45:24.467664,0 days 00:01:57.125863,0.5,16,64,shallow,0.00043878464672564613,True,"{""alpha"": 0.5, ""batch_size"": 16, ""bottleneck_dim"": 64, ""channel_config"": ""shallow"", ""learning_rate"": 0.00043878464672564613}",COMPLETE
11,0.33372411504387856,2026-10-03 05:45:24.476921,2026-10-03 05:47:19.181761,0 days 00:01:54.704840,0.6,16,64,shallow,0.0007579094746965941,True,"{""alpha"": 0.6, ""batch_size"": 16, ""bottleneck_dim"": 64, ""channel_config"": ""shallow"", ""learning_rate"": 0.0007579094746965941}",COMPLETE
12,0.3402389734983444,2026-10-03 05:47:19.191306,2026-10-03 05:49:14.326574,0 days 00:01:55.135268,0.65,16,64,shallow,0.0005161995105679136,True,"{""alpha"": 0.65, ""batch_size"": 16, ""bottleneck_dim"": 64, ""channel_config"": ""shallow"", ""learning_rate"": 0.0005161995105679136}",COMPLETE
13,0.5886732041835785,2026-10-03 05:49:14.336202,2026-10-03 05:50:23.710136,0 days 00:01:09.373934,0.5,64,64,shallow,0.00011794453301126019,True,"{""alpha"": 0.5, ""batch_size"": 64, ""bottleneck_dim"": 64, ""channel_config"": ""shallow"", ""learning_rate"": 0.00011794453301126019}",PRUNED
14,0.5053212270140648,2026-10-03 05:50:23.719751,2026-10-03 05:51:35.840707,0 days 00:01:12.120956,0.55,64,64,shallow,0.0010269565737160726,True,"{""alpha"": 0.55, ""batch_size"": 64, ""bottleneck_dim"": 64, ""channel_config"": ""shallow"", ""learning_rate"": 0.0010269565737160726}",PRUNED
15,0.5751051902770996,2026-10-03 05:51:35.850892,2026-10-03 05:52:49.636180,0 days 00:01:13.785288,0.6,16,64,standard,0.003126438950793031,True,"{""alpha"": 0.6, ""batch_size"": 16, ""bottleneck_dim"": 64, ""channel_config"": ""standard"", ""learning_rate"": 0.003126438950793031}",PRUNED
