number,value,datetime_start,datetime_complete,duration,params_batch_size,params_channel_config,params_dropout,params_learning_rate,params_weight_decay,system_attrs_tpe:relative_params:0,state
0,0.995923642137134,2026-10-03 04:41:52.148037,2026-10-03 04:44:51.106219,0 days 00:02:58.958182,16,small,0.45,0.0005611516415334506,0.0006358358856676254,,COMPLETE
1,0.995927585112541,2026-10-03 04:44:51.113600,2026-10-03 04:47:44.584661,0 days 00:02:53.471061,32,small,0.15000000000000002,0.0026070247583707684,0.00037520558551242813,,COMPLETE
2,0.9972826086956521,2026-10-03 04:47:44.591691,2026-10-03 04:51:22.394389,0 days 00:03:37.802698,32,large,0.4,0.0007309539835912913,3.972110727381908e-05,,COMPLETE
3,0.9945652173913043,2026-10-03 04:51:22.401747,2026-10-03 04:55:22.682698,0 days 00:04:00.280951,64,large,0.5,0.0010677482709481358,0.002661901888489057,,COMPLETE
4,0.9959238829445515,2026-10-03 04:55:22.698073,2026-10-03 04:58:43.677109,0 days 00:03:20.979036,32,medium,0.5,0.0004066563313514797,5.9750279999602906e-05,,COMPLETE
5,0.9891107308774548,2026-10-03 04:58:43.684500,2026-10-03 05:01:42.373064,0 days 00:02:58.688564,64,medium,0.5,0.0021137059440645744,0.004835952776465951,,PRUNED
6,0.9972826086956521,2026-10-03 05:01:42.379550,2026-10-03 05:05:18.933175,0 days 00:03:36.553625,16,large,0.1,0.0015696396388661157,0.003063462210622081,,COMPLETE
7,0.9945725016569703,2026-10-03 05:05:18.942481,2026-10-03 05:08:12.819675,0 days 00:02:53.877194,32,large,0.4,0.0005170191786366995,3.9459088110999965e-05,,PRUNED
8,0.9770346470893414,2026-10-03 05:08:12.825817,2026-10-03 05:10:34.963099,0 days 00:02:22.137282,16,small,0.05,0.00010257563974185662,0.0038842777547031426,,PRUNED
9,0.9959238829445515,2026-10-03 05:10:34.969093,2026-10-03 05:13:58.172310,0 days 00:03:23.203217,16,medium,0.45,0.0017643967683381545,0.00026100256506134784,,PRUNED
10,0.993217288415563,2026-10-03 05:13:58.179039,2026-10-03 05:16:53.688765,0 days 00:02:55.509726,32,large,0.2,0.0004245366374872317,0.002017794516239148,"{""batch_size"": 32, ""channel_config"": ""large"", ""dropout"": 0.2, ""learning_rate"": 0.0004245366374872317, ""weight_decay"": 0.002017794516239148}",PRUNED
11,0.9918366595478313,2026-10-03 05:16:53.695107,2026-10-03 05:19:50.663754,0 days 00:02:56.968647,16,large,0.2,0.00407134150406791,0.0027012741831013475,"{""batch_size"": 16, ""channel_config"": ""large"", ""dropout"": 0.2, ""learning_rate"": 0.00407134150406791, ""weight_decay"": 0.0027012741831013475}",PRUNED
