number,value,datetime_start,datetime_complete,duration,params_alpha,params_batch_size,params_bottleneck_dim,params_dropout,params_encoder_channels,params_learning_rate,user_attrs_trained,system_attrs_tpe:relative_params:0,state
0,,2026-10-03 03:36:03.617764,2026-10-03 03:36:03.658145,0 days 00:00:00.040381,0.9162213204002109,16,512,0.48495492608099716,m,0.0005611516415334506,False,,PRUNED
1,,2026-10-03 03:36:03.666645,2026-10-03 03:36:03.687928,0 days 00:00:00.021283,0.8925879806965068,64,512,0.22803499210851796,l,0.00026587543983272726,False,,PRUNED
2,,2026-10-03 03:36:03.694828,2026-10-03 03:36:03.720695,0 days 00:00:00.025867,0.8421165132560784,32,512,0.048836057003191935,s,0.00025081156860452336,False,,PRUNED
3,0.3485931418836117,2026-10-03 03:36:03.729481,2026-10-03 03:41:17.858616,0 days 00:05:14.129135,0.8875664116805573,32,64,0.4847923138822793,m,0.0007591104805282694,True,,COMPLETE
4,,2026-10-03 03:41:17.868237,2026-10-03 03:41:17.889996,0 days 00:00:00.021759,0.6404672548436904,64,512,0.17837666334679464,l,0.007568292060167619,False,,PRUNED
5,0.32894499599933624,2026-10-03 03:41:17.897610,2026-10-03 03:44:21.302468,0 days 00:03:03.404858,0.5370223258670452,32,64,0.38563517334297287,s,0.001217284708112243,True,,COMPLETE
6,0.4481995925307274,2026-10-03 03:44:21.311577,2026-10-03 03:47:42.327483,0 days 00:03:21.015906,0.5597971229691509,32,64,0.23610746258097465,l,0.0005211124595788264,True,,COMPLETE
7,0.5106564611196518,2026-10-03 03:47:42.337347,2026-10-03 03:51:24.165336,0 days 00:03:41.827989,0.7542853455823514,64,128,0.15717799053816334,l,0.0026698666742744613,True,,COMPLETE
8,,2026-10-03 03:51:24.174960,2026-10-03 03:51:24.196578,0 days 00:00:00.021618,0.9018360384495572,64,256,0.43573029509385885,s,0.006533305220227739,False,,PRUNED
9,0.4438895918428898,2026-10-03 03:51:24.204594,2026-10-03 03:55:00.678593,0 days 00:03:36.473999,0.7553736512887829,16,64,0.0034760652655953517,l,0.00023612399244412623,True,,COMPLETE
10,,2026-10-03 03:55:00.688186,2026-10-03 03:55:00.717868,0 days 00:00:00.029682,0.6369634021444858,32,128,0.4178235848478135,s,0.00614415330800041,False,"{""alpha"": 0.6369634021444858, ""batch_size"": 32, ""bottleneck_dim"": 128, ""dropout"": 0.4178235848478135, ""encoder_channels"": ""s"", ""learning_rate"": 0.00614415330800041}",PRUNED
11,0.613321103155613,2026-10-03 03:55:00.726546,2026-10-03 03:56:26.500210,0 days 00:01:25.773664,0.9161514794453901,32,64,0.4143124612219168,l,0.0003833537033860606,True,"{""alpha"": 0.9161514794453901, ""batch_size"": 32, ""bottleneck_dim"": 64, ""dropout"": 0.4143124612219168, ""encoder_channels"": ""l"", ""learning_rate"": 0.0003833537033860606}",PRUNED
12,,2026-10-03 03:56:26.510315,2026-10-03 03:56:26.540167,0 days 00:00:00.029852,0.9231804733625982,32,512,0.3713633058655375,s,0.0013083585804415845,False,"{""alpha"": 0.9231804733625982, ""batch_size"": 32, ""bottleneck_dim"": 512, ""dropout"": 0.3713633058655375, ""encoder_channels"": ""s"", ""learning_rate"": 0.0013083585804415845}",PRUNED
13,0.3249299079179764,2026-10-03 03:56:26.549128,2026-10-03 03:59:32.357602,0 days 00:03:05.808474,0.5298615269683793,32,64,0.28919970832396347,s,0.0011890872568472131,True,"{""alpha"": 0.5298615269683793, ""batch_size"": 32, ""bottleneck_dim"": 64, ""dropout"": 0.28919970832396347, ""encoder_channels"": ""s"", ""learning_rate"": 0.0011890872568472131}",COMPLETE
14,0.3432036265730858,2026-10-03 03:59:32.368495,2026-10-03 04:02:36.652941,0 days 00:03:04.284446,0.6186460642639525,32,64,0.4942114442962831,s,0.0011795588339421788,True,"{""alpha"": 0.6186460642639525, ""batch_size"": 32, ""bottleneck_dim"": 64, ""dropout"": 0.4942114442962831, ""encoder_channels"": ""s"", ""learning_rate"": 0.0011795588339421788}",COMPLETE
15,0.32390429452061653,2026-10-03 04:02:36.664305,2026-10-03 04:05:41.851160,0 days 00:03:05.186855,0.5089300991904646,32,64,0.36882130217295994,s,0.0018130096324592306,True,"{""alpha"": 0.5089300991904646, ""batch_size"": 32, ""bottleneck_dim"": 64, ""dropout"": 0.36882130217295994, ""encoder_channels"": ""s"", ""learning_rate"": 0.0018130096324592306}",COMPLETE
16,0.42978066205978394,2026-10-03 04:05:41.862082,2026-10-03 04:07:09.646884,0 days 00:01:27.784802,0.6143112209901891,32,64,0.31107368240682687,s,0.0023551954418383554,True,"{""alpha"": 0.6143112209901891, ""batch_size"": 32, ""bottleneck_dim"": 64, ""dropout"": 0.31107368240682687, ""encoder_channels"": ""s"", ""learning_rate"": 0.0023551954418383554}",PRUNED
17,,2026-10-03 04:07:09.658373,2026-10-03 04:07:09.702132,0 days 00:00:00.043759,0.5751685283311373,32,256,0.26945372451717675,s,0.0002440579992884053,False,"{""alpha"": 0.5751685283311373, ""batch_size"": 32, ""bottleneck_dim"": 256, ""dropout"": 0.26945372451717675, ""encoder_channels"": ""s"", ""learning_rate"": 0.0002440579992884053}",PRUNED
18,0.4192207455635071,2026-10-03 04:07:11.755007,2026-10-03 04:08:38.949288,0 days 00:01:27.194281,0.515558154645319,32,64,0.15370925945505928,s,0.001441198347972206,True,"{""alpha"": 0.515558154645319, ""batch_size"": 32, ""bottleneck_dim"": 64, ""dropout"": 0.15370925945505928, ""encoder_channels"": ""s"", ""learning_rate"": 0.001441198347972206}",PRUNED
19,0.45098863542079926,2026-10-03 04:08:38.961360,2026-10-03 04:10:17.150983,0 days 00:01:38.189623,0.5513286214709741,32,64,0.1353140009840067,s,0.00014875528370059978,True,"{""alpha"": 0.5513286214709741, ""batch_size"": 32, ""bottleneck_dim"": 64, ""dropout"": 0.1353140009840067, ""encoder_channels"": ""s"", ""learning_rate"": 0.00014875528370059978}",PRUNED
