number,value,datetime_start,datetime_complete,duration,params_alpha,params_batch_size,params_bottleneck_dim,params_dropout,params_encoder_channels,params_learning_rate,system_attrs_tpe:relative_params:0,state
0,0.3145977854728699,2026-10-03 02:11:20.988624,2026-10-03 02:19:45.353846,0 days 00:08:24.365222,0.9162213204002109,16,512,0.48495492608099716,m,0.0005611516415334506,,COMPLETE
1,0.5237689688801765,2026-10-03 02:19:45.379116,2026-10-03 02:24:56.676237,0 days 00:05:11.297121,0.8925879806965068,64,512,0.22803499210851796,l,0.00026587543983272726,,COMPLETE
2,0.36083148419857025,2026-10-03 02:24:56.688035,2026-10-03 02:29:18.547628,0 days 00:04:21.859593,0.8421165132560784,32,512,0.048836057003191935,s,0.00025081156860452336,,COMPLETE
3,0.3445727862417698,2026-10-03 02:29:18.558602,2026-10-03 02:36:22.135661,0 days 00:07:03.577059,0.8875664116805573,32,64,0.4847923138822793,m,0.0007591104805282694,,COMPLETE
4,0.4936599060893059,2026-10-03 02:36:22.148627,2026-10-03 02:41:37.082024,0 days 00:05:14.933397,0.6404672548436904,64,512,0.17837666334679464,l,0.007568292060167619,,COMPLETE
5,0.32855816930532455,2026-10-03 02:41:37.093619,2026-10-03 02:45:58.044152,0 days 00:04:20.950533,0.5370223258670452,32,64,0.38563517334297287,s,0.001217284708112243,,COMPLETE
6,0.5250036343932152,2026-10-03 02:45:58.056375,2026-10-03 02:47:57.581243,0 days 00:01:59.524868,0.5597971229691509,32,64,0.23610746258097465,l,0.0005211124595788264,,PRUNED
7,0.6199635714292526,2026-10-03 02:47:57.593038,2026-10-03 02:50:08.357499,0 days 00:02:10.764461,0.7542853455823514,64,128,0.15717799053816334,l,0.0026698666742744613,,PRUNED
8,0.5808182880282402,2026-10-03 02:50:08.367288,2026-10-03 02:52:14.955211,0 days 00:02:06.587923,0.9018360384495572,64,256,0.43573029509385885,s,0.006533305220227739,,PRUNED
9,0.5431898757815361,2026-10-03 02:52:14.964989,2026-10-03 02:54:33.703969,0 days 00:02:18.738980,0.7553736512887829,16,64,0.0034760652655953517,l,0.00023612399244412623,,PRUNED
10,0.2877439595758915,2026-10-03 02:54:33.715730,2026-10-03 03:02:15.625491,0 days 00:07:41.909761,0.5221755361114921,16,512,0.14130645376129758,m,0.00012787785905758723,"{""alpha"": 0.5221755361114921, ""batch_size"": 16, ""bottleneck_dim"": 512, ""dropout"": 0.14130645376129758, ""encoder_channels"": ""m"", ""learning_rate"": 0.00012787785905758723}",COMPLETE
11,0.2917974181473255,2026-10-03 03:02:15.634853,2026-10-03 03:09:47.766339,0 days 00:07:32.131486,0.6384893274991719,16,512,0.4821491650978249,m,0.00016838059247663444,"{""alpha"": 0.6384893274991719, ""batch_size"": 16, ""bottleneck_dim"": 512, ""dropout"": 0.4821491650978249, ""encoder_channels"": ""m"", ""learning_rate"": 0.00016838059247663444}",COMPLETE
12,0.3017535135149956,2026-10-03 03:09:47.777296,2026-10-03 03:17:53.632228,0 days 00:08:05.854932,0.5150337456422922,16,512,0.42535590933979467,m,0.00011420157679273673,"{""alpha"": 0.5150337456422922, ""batch_size"": 16, ""bottleneck_dim"": 512, ""dropout"": 0.42535590933979467, ""encoder_channels"": ""m"", ""learning_rate"": 0.00011420157679273673}",COMPLETE
13,0.28761792182922363,2026-10-03 03:17:53.646327,2026-10-03 03:26:46.262137,0 days 00:08:52.615810,0.5272375297277364,16,512,0.01980262071418848,m,0.00012357235516175183,"{""alpha"": 0.5272375297277364, ""batch_size"": 16, ""bottleneck_dim"": 512, ""dropout"": 0.01980262071418848, ""encoder_channels"": ""m"", ""learning_rate"": 0.00012357235516175183}",COMPLETE
14,0.2996072918176651,2026-10-03 03:26:46.273693,2026-10-03 03:33:58.892958,0 days 00:07:12.619265,0.5742675583033433,16,512,0.10615590520226653,m,0.00010078137858036406,"{""alpha"": 0.5742675583033433, ""batch_size"": 16, ""bottleneck_dim"": 512, ""dropout"": 0.10615590520226653, ""encoder_channels"": ""m"", ""learning_rate"": 0.00010078137858036406}",COMPLETE
15,,2026-10-03 03:33:58.899877,2026-10-03 03:35:31.921036,0 days 00:01:33.021159,0.5307546514591445,16,512,0.01888273642273787,m,0.00036024761642691923,"{""alpha"": 0.5307546514591445, ""batch_size"": 16, ""bottleneck_dim"": 512, ""dropout"": 0.01888273642273787, ""encoder_channels"": ""m"", ""learning_rate"": 0.00036024761642691923}",FAIL
